Title,Author,Score,URL,Text
"Theres a leak under our shower, do I contact plumber, homeserve or insurance?",Stubee1988,2,https://www.reddit.com/r/AskUK/comments/15ng8ar/theres_a_leak_under_our_shower_do_i_contact/,Sorry for the stupid question but am new to being a homeowner and being responsible for this stuff. Think there's a leak under the shower in our ensuite as some stains are appearing on the ceiling underneath it downstairs. I have home insurance and homeserve plumbing cover. Do I get homeserve to fix it then contact insurance to get any damage repaired?
Did you adult today?,CaptMelonfish,0,https://www.reddit.com/r/AskUK/comments/17a9jft/did_you_adult_today/,"This morning I renewed my home insurance, getting a better policy at a cheaper price. I capped my energy with my provider and organised boiler cover for the new boiler.
Then I washed and dried all the towels.

I mean, that's me for the month, there's very little chance of me doing anything else but watching cartoons for the rest of the week at the least.

What did you do today that you'd consider an ""Adult"" task?"
Do UK insurance contractors make up their prices to fix things?,ohbroth3r,3,https://www.reddit.com/r/AskUK/comments/1cxvbjg/do_uk_insurance_contractors_make_up_their_prices/,"Broke a window, called the home insurance, they sent the job to Evander, they sent Evander employee with Evander T Shirt and Evander van to measure the window.
He asked me if I wanted to know the price of the window in case I wanted to avoid going through the insurance, I said no as I was adamant the window would cost more than the excess of £200.
When he left I thought I might just ask when they call me before I pay them the £200.
I get a call, they tell me to progress the claim I need to pay the £200 excess, I ask how much the claim was total and they don't know. They try to ring another department but they're not in.
They call back two days later, different guy, says he's my case handler and the other person was inexperienced and he will get the price from the technical department. Waits two days  and calls me back and says it's £190 claim. So do I still want to go through insurance.
I think about it and then ask 'how come you were asking me to pay £200 on two separate calls without Knowing how much the claim was for?
He says 'oh we would always check, because I'm so experienced with claims I would never just ask someone to pay without checking because I'd think , hmm I bet that isn't the worth the full excess' 
So I say ""well the first person didn't check and neither did you until I asked you to check. If you're phoning people up asking to settle the excess and you don't have the claim cost on your screen then how can you phone up to have that conversation? ""
He then says that he would just know what to do but some others might not. 
Something tells me he thought he was doing good by me by making it cheaper than £200 and giving me less of a bill, but I'm super pissed that they seem to be able to make up a price or would have made money out of me if I hadn't asked

How the heck do these companies operate?"
Water leak repair. Can I cover it with insurance claim?,kingsolo84,1,https://www.reddit.com/r/AskUK/comments/15cifps/water_leak_repair_can_i_cover_it_with_insurance/,"I have discovered a water leakage problem due to sink tap water and bath tub water. I am getting it fix in a week but my question is shall I fix it by approved watersafe plumber and then claim it from my home insurance as I am covered.

Thanks.

P.S I have all the pictures of before and after and video of area from where water is leaking."
Underpinning during extension works but no building control paperwork. Is this a problem?,RelativeSafety1859,2,https://www.reddit.com/r/AskUK/comments/1dz4ylv/underpinning_during_extension_works_but_no/,"We are trying to buy a house where a big extension was done in 2006 after getting planning permission. The council planning permission says “Underpinning and extension”. The house is really nice. Surveyor did notice the underpinning in records but did not make it an issue. He was the bank’s surveyor so valued the house at the correct/agreed price with no issues. According to the surveyor nothing to indicate any issues structurally (He is not a structural surveyor of course).

Our solicitors have raised this and asked for paperwork. The vendor has sent over some architectural drawings which talks about underpinning but when asked about building control sign off, the vendor responded by saying that they never got it. So our solicitors have gone back (without asking me), to push for a retrospective Building control inspection to sign off the works.

My question are:
1.	Is it common to have underpinning done when extending? It was a big extension, small bungalow to an almost 200sqm house. Our environmental survey did point the whole area as having soft soil so the whole town is at high risk of subsidence.
2.	Was there even a requirement to get things signed off by Building control back in 2006?
3.	How much would this bother anyone?
4.	Would home insurance be an issue? Some of them ask if there ever was underpinning and some specifically ask about subsidence.
Thanks"
What can I do about our horrible neighbour causing flooding on our driveway?,Stirlar05,5,https://www.reddit.com/r/AskUK/comments/15dt801/what_can_i_do_about_our_horrible_neighbour/,"Hi all,

We’ve got pretty awful neighbours who take absolutely no care of their house and won’t seem to speak to us at all. 

They have a gutter on the front of their house which runs into a drain at the bottom of the driveway (our driveways slope downwards towards the house). When it rains the drain overflows and causes water to build up and the front of our house in a huge puddle which is causing damp. 

We contacted our water board who inspected the drain and advised that the pipe had collapsed underground and needed replacing. They told us to contact our home insurance. 

The drain is on our neighbours property so should we be footing this bill?"
What kind of insurance would help pay for personal items lost due to structural damage from rodents?,samzeman,2,https://www.reddit.com/r/AskUK/comments/qqqaiv/what_kind_of_insurance_would_help_pay_for/,"I rent a flat.

I know I'm making a few leaps here, and this answer wouldn't even help me if the rodents are already in the house and I don't have the insurance - but I'm paranoid. If they chew through something important and spray water all over the inside of the floor under my room, and the floor falls through or my room floods, is there a type of insurance that would protect my stuff (probably my computer most of all)? 

I know not renter's insurance from Google, and not home insurance. It's the landlord's duty to make sure rodents can't get in though, so as long as I've done all I can (not leaving food out, putting mesh on the holes I find)"
Are you paying more because you can’t pay upfront?,nottsgal,71,https://www.reddit.com/r/AskUK/comments/85wqa8/are_you_paying_more_because_you_cant_pay_upfront/,"The term 'poverty premium' is used to estimate how much more low-income households pay than higher income households for the same goods and services. 

It can mean that a typical low-income family can pay up to £1,700 per year more for the same essential goods and services as a similar higher income family. This is the equivalent of two months' rent outside of London.

The All-Party Parliamentary Group (APPG) on Poverty is holding an inquiry to understand the extent of the 'poverty premium' so that it can make recommendations to Government and businesses on how to tackle it. To do this the APPG wants to hear your thoughts. 

There are many examples of the 'poverty premium' in practice, for example households on lower incomes are more likely to have to:

- prepay for their energy, even though this is more expensive than paying for it monthly
- use expensive credit like payday loans to make ends meet 
- pay for household goods like TVs or washing machines in instalments, despite this sometimes costing three times as much as paying upfront
- pay for car or home insurance monthly, despite this costing more than paying annually

If the 'poverty premium' has affected you, please share your story. 

The APPG will be collecting your comments on Money Saving Expert website until 28th March 2018. Share your story [HERE](http://forums.moneysavingexpert.com/showthread.php?t=5811313&page=2#topofpage)

EDIT: they are also accepting direct submissions to them if you dont want to share your experiences with others - you can do this by completing an online form found - [HERE](http://www.appgpoverty.org.uk/home-page/poverty-premium-inquiry-and-business-toolkit/)"
Do you get your boiler serviced annually? How easy is it to find willing engineers where you are?,MachiavellianKarp,5,https://www.reddit.com/r/AskUK/comments/ppxdde/do_you_get_your_boiler_serviced_annually_how_easy/,"Since buying our place a few years ago, my wife and I have always had an annual boiler service. It’s that time of year again and by god is it hard to find someone willing to do such a “small” job. More than one local engineer has asked why on Earth I’d bother with a service…

…well it’s a requirement of our home insurance for cover (presumably for boiler related things) to be valid. Must be <15 years old and serviced annually.

Is this something many homeowners really are just laissez faire about?"
What's the fairest way to split household bills?,Far_Camel_5098,0,https://www.reddit.com/r/AskUK/comments/xqa61v/whats_the_fairest_way_to_split_household_bills/,"I am a divorced single parent.  My kids are 20 and 17.  Eldest at Uni but living at home.  Youngest doing A levels at college.

My new partner moved in during lockdown and we've decided to live together forever now.   I'll be adding her to the mortgage and we will become ""tenants in common"" so that I can protect the equity I built up before we met, but she can have a stake in the property and benefit from the home improvements she's done with me since moving in.

If we stay together forever I'll probably sign over half of the house to her eventually, or split it 3 ways between her and my kids.

My question is about the other household bills I.e. NOT the mortgage.

It wouldn't be fair for me to ask her to pay 1/2 of energy, council tax, water and home insurance etc.  After all - my kids are not her kids and she's not responsible for them.

But the kids aren't earning yet apart from a bit of cash from part time jobs so I don't think her paying 1/4 of the bills is fair on me either.

So do I just split the difference between 1/4 and 1/2 and ask her to pay 1/3?"
What type of house do I live in? (For insurance purposes),internetf1fan,2,https://www.reddit.com/r/AskUK/comments/yv57ux/what_type_of_house_do_i_live_in_for_insurance/,"So I am renewing my home insurance and my current provider was double checking type my house is. I always assume it was end of terrace or semi-detached, but since the garages are attached with my neighbours, I am now very confused. 

Here's the layout of the houses from front and top view. I am house number 3 with garage number 3. There is no entry to garage from inside the house, there is a door at the back garden. 

https://i.imgur.com/TvQ1vJn.png

What even is this? end of terrace? mid terrace? linked semi detached?

Appreciate any advice.

Edit: FYI Zoopla has it listed as End of terrace while Rightmove has it listed as Terraced."
Spongey floorboard in downstairs loo - what trade do I need?,carlhunt3r,1,https://www.reddit.com/r/AskUK/comments/122rtim/spongey_floorboard_in_downstairs_loo_what_trade/,"Hey reddit, not sure where to turn with this. I've noticed in my downstairs toilet the flooring feels a bit sponge-y near the wall, which has a radiator on it, and on the corner where the toilet is... i.e. a lot of water-type stuff. Therefore, I am wondering if I've got a leak somewhere. 

I've isolated the radiator, which hasn't improved the situation (perhaps made it worse as its not drying out anymore?), and I can't see anything obviously wrong around the toilet pan. Do I need a generic plumber to help find the suspected leak or would it be a handyman or specialist like a drain engineer? I've got emergency coverage on my home insurance however that can only be used once the leak has been identified (""trace and access"" is not included, apparently)

Any help is greatly appreciated fellow UK redditors!"
Getting new windows fitted - do I need any kind of insurance or legal cover?,dudetwelvetimes,1,https://www.reddit.com/r/AskUK/comments/8m97fi/getting_new_windows_fitted_do_i_need_any_kind_of/,"Hello all,


I'm getting some quotes to have new windows installed in my flat (uPVC, double-glazed). Someone just mentioned to me that I should have home insurance for legal-related reasons in case one of the workers has an accident or something. Is this true - do I need to have some kind of legal cover? Would the window-installation company not have their own legal cover...? Would it best for me to get home insurance (like contents insurance) to cover this kind of thing?


Thank you!"
My Home emergency claim is on hold because the locksmith's company has an invalid VAT number. What do I do?,BlackKojak,1,https://www.reddit.com/r/AskUK/comments/pejkya/my_home_emergency_claim_is_on_hold_because_the/,"Last Wednesday, I accidentally locked myself out of my flat at night.

I panicked and looked up a [locksmith company](https://nearest-locksmith24.co.uk/) through Google. They assigned me a locksmith that arrived in 20 mins.

While waiting, I was curious to find out if my home insurance offers and covers it. They offered a £500 emergency repair cover and affiliated companies. I told them I called one on the way but would've gone through them if I knew ahead of time. They assured me that they'd reimburse me as long as I provide the itemised receipt and cause of the issue.

The locksmith arrived, I explained the situation (key on the inside, lock jammed) then gave me a quote for the job. He did a great job and replaced the old lock with a new secure lock. He gave me a receipt, I paid then went his way.

While scanning the receipts, I wondered why the locksmith didn't ask to confirm if I'm the homeowner. I thought that would've been part of the procedure.

**Recent development**

My home insurer calls back to let me know **my claim is on hold** because the locksmith's VAT number is invalid. They've asked me to provide a valid VAT number but don't know how to get in touch with the locksmith's company.

I've tried:

1. Contacting the locksmith agency (they told me to contact the locksmith)
2. Contacting the tradesman (not responding to calls or recent texts)
3. Sending an email to the locksmith company (Name, address, email, business and VAT number are on the receipt)
4. Contacting Citizens Advice Bureau (aren't available since it's a bank holiday)
5. Looking up the company via [Companies Register](https://find-and-update.company-information.service.gov.uk/company/11897036). They are active but have no contact info.

If I can't get hold of the locksmiths, what options do I have? I was really looking forward to getting my £390 back."
"I'm a Tennant, and the tree in the garden has fell into the neighbours garden. Am I liable or is it the landlord?",scathachmkat,1,https://www.reddit.com/r/AskUK/comments/xbnjxo/im_a_tennant_and_the_tree_in_the_garden_has_fell/,"So with the weather we had last week, part of the tree has fallen down into a neighbors garden and broke a fencing panel. As soon as we had realised, myself and my girlfriend who live together contacted the letting agency about the situation and sent photos. We haven't took an axe to the tree, and we haven't caused any damage to the tree.tp cause it to fall.

We recently got a response that the letting agency is looking into it, and quote: ""getting a quote for you"".

The writing of it makes me think that the letting agency or/and the landlord is expecting us to fork out the money for it. I'm stressed that this is the case and that we can't afford it. I'm under the impression from looking it up online that it's the landlord who should be liable and not us, and that the landlords home insurance should cover it but I don't know if that's how reality works. 

I've had issues with the landlord in the past, such as arriving at the house without notification, as well as unlocking the house and entering without permission."
"House insurance, what should I do?",Richie2516,0,https://www.reddit.com/r/AskUK/comments/szse7g/house_insurance_what_should_i_do/,"Evening all,

Obligatory typed on mobile warning.

Sorry for the long boring post but not sure where else to address to.

In November last year, my neighbour had a small electrical fire in his loft (not a grow...) luckily he spotted it straight away and had fire brigade there in minutes.  I'd only moved in 6 days prior to this and due to the shifts I was on I hadn't got round to emptying the storage facility that all the non essential stuff for the house move was kept which included the entire contents of my loft.

The only affect on my property was smoke damage, it did blacken all the boards and insulation in the loft so this has been replaced under (currently) my home insurance with a £250 excess.

It did mean however that I had to leave the contents of my loft in storage so I brought home what I could and reduced the storage size as much as I was able to and started a new contract which ran for 3 months, ending 4 days after my loft was boarded out.  When I last spoke to the insurance company they stated because the loft was empty during the fire they will not reimburse the cost of storage for the 3 months.

This week scaffolding has been put up next door to address the issues with the neighbours roof, the company did contact me to ask permission to overhang on my property slightly to provide more cover to which I agreed as I didn't think it would cause an issue but they have removed the top bracket on my TV aerial and rested it on the side of the chimney to fit this cover over, this has left me without live TV for the next 6 weeks.

So my questions are;

Do I get my excess back through neighbours insurance?
Should I be entitled to the cost of storage being refunded?
What can I do about not having TV due to scaffolding next door?

Thanks."
Where Can I Get Accidental Watch Insurance,vikingdog,3,https://www.reddit.com/r/AskUK/comments/26vibe/where_can_i_get_accidental_watch_insurance/,"Im looking to buy a watch, and Ive seen it for £109 online and £145 in H Samuel. HS offers their own insurance cover for up to 5 years but is an extra £30. Im struggling to find a company that would insure/cover a watch. When I search Watch insurance I get high class jewellery insurance or home insurance, and accidental watch insurance, is asking me if Ive been involved in a car accident.   
edit  the lightest scratch could ruin it link to the watch  http://www.sarahbeth.co.uk/citizen-watch-stainless-steel-with-black-ion-plating-eco-drive-mens-sport-bv1085-06e-13917-p.asp
"
How to stop scam calls?,Born-Veterinarian-44,6,https://www.reddit.com/r/AskUK/comments/ihjpe5/how_to_stop_scam_calls/,"Hello, lately I’ve been getting some scam calls and texts from various numbers. Mostly about home insurance, car offers and also sometimes an automated call asking me to confirm if I I’ve had a car accident which is false. My telephone provider doesn’t really help me so I am not sure what to do..."
I own a leasehold flat with my husband. The windy rains make our ceilings against the exterior of the flat leak. Am I able to get the council to do something to fix this?,taliewood,7,https://www.reddit.com/r/AskUK/comments/l1mi4l/i_own_a_leasehold_flat_with_my_husband_the_windy/,"As mentioned, I own a flat with my husband. I'm an expat, so I don't really know how these things work.

We live on the ground floor of a 4 unit house. 3 units are leasehold, and the one above ours is an elderly council resident. The building belongs to the council.

Last January and February we noticed whenever there was a particularly bad combo of rain and wind, our window sill in the bedroom would be covered in water. We have narrowed the water entrance down to a crack along where the wall meets drop ceiling over the window. 

We believe the bricks of the building are letting water in when the wind blows it at the right angle and it's running in to our flat. I called the council last winter to query, but nothing was done and I never heard back. 

I want to call insurance, but my husband insists home insurance won't cover it when the bricks belong to the council. The council didn't return my calls last year. I've just come into my bedroom today to see the same.

We've just repainted and are trying to make a home for ourselves. I really don't want it to mould and fall apart to damp around our feet.

Can someone please, please advise me what the right course of action is?

Thank you so much in advance for any help you can provide!"
"Who is responsible for a roof repair, me or the factors?",WellFiredRoll,2,https://www.reddit.com/r/AskUK/comments/sxadir/who_is_responsible_for_a_roof_repair_me_or_the/,"I've lived in my top-floor flat for about a decade now and up until this past week I've not had any major issues.  We all know what happened this week and whilst my building was well out of the way of Eunice and her temper tantrum (I'm in Glasgow), I've noticed that my roof has started to leak.  I had someone go into the roof-space for me a few days ago and he came back down and said, yup, there's water getting into the roof-space round about a roof anchor (it's a metal loop fixed into the roof that allows for maintenance workers to hook themselves safely to the building).  Thing is:  the water damage itself must have been going on for the past couple of years and I know that my building hasn't had the normal annual inspection of the roof anchors because of You Know What.  

So, now I've got a roofing contractor coming up to assess the damage and see if they can implement a quick-fix on Tuesday (and if they can't, they'll try and at least mitigate the ingress).  That's fine.  I'm not really that fussed about getting the roof fixed - I have good insurance, never made a claim, all that jazz.  But I've started worrying (at the speed of dark, such as the way my mind works) - but I am worried about getting the water-staining on my ceiling fixed.  Should I get the factor to repair that (even though I own my flat, someone pointed out to me that the ingress itself isn't my fault and my factor should have made arrangements for an inspection as soon as the various lockdowns came to an end) or should I claim it on my home insurance?  I don't want to arse it up - I'm planning on selling up and moving to a smaller place this year and I'm worrying about my insurance company demanding to know why I never reported the ingress to *them* in the first place.  As you can tell, yeah, I'm pretty shit at this sort of thing.  I mean, is the roof repair solely my responsibility (because it's affecting only my flat) or is it the responsibility of the factor (because they maintain the entire fabric of the building)?"
Boiler service paperwork?,LittlePinkNinja,1,https://www.reddit.com/r/AskUK/comments/fp8fjd/boiler_service_paperwork/,"Hi folks,

I had my boiler repaired and serviced in January so that it was covered fully by the boiler insurance I took out through my home insurance.

My boiler chap gave me an invoice stating it had been serviced and a part replaced.

I now need to make a claim as I've been without hot water and heating since Friday. I called them and they've told me my invoice isn't enough and I need some sort of service document.

I've never had one of those before, my mum hasn't had one and my partner hasn't had one as far as they remember.

Is this commonplace? My boiler repair guy isnt answering calls so I can't ask him to give me a different document so I'm a bit stuck.

Ta"
Can I use this front door handle/lock in the UK?,dwwwwwt,7,https://www.reddit.com/r/AskUK/comments/3caspb/can_i_use_this_front_door_handlelock_in_the_uk/,"I'm purchasing a new front door and can't find a handle like this one anywhere. They are common in the US but can't find one in any UK store. 

http://www.homedepot.com/p/Kwikset-Arlington-Single-Cylinder-Satin-Nickel-Handle-Set-with-Lido-Lever-Feat-SmartKey-800ANXLL-15-SMT-CP/100597293

Is there a reason for this? Does it have something to do with special uk/eu regulations over safety/security? If I were to find one and install it would it affect my home insurance? Thanks!"
"If I phone to cancel a renewal, get fed up with being passed around 5 times and just send them an email cancelling, and cancel the direct debit, do they have any recourse?",Riffler,2,https://www.reddit.com/r/AskUK/comments/3uzu6o/if_i_phone_to_cancel_a_renewal_get_fed_up_with/,"Fucking AA. Got a free membership with my home insurance last year; cancelling it by phone is a bad joke; told the 6th person I had to speak to to go fuck himself; emailed their complaints dept instead. I know that's the whole point of free membership, but if they chase for the money and my bank screws up and pays them, or they sue, what are my chances?"
