Title,Author,Score,URL,Text
Is there any point to home insurance?,FrankFriedPotato,0,https://www.reddit.com/r/AskUK/comments/1bkhgo6/is_there_any_point_to_home_insurance/,"Im watching some show on Rakuten called Home Horrors or something.   
So many people have had their houses collapse, or burn, or something that destroys their house.   
Nearly all of them the insurance companies do nothing and let the plots rot for years,   


So I need some uplifting news? is it worth it? has it ever helped you? Ive had it for years for like 1k a year"
Home insurance called our builder to haggle on claim - is this standard practice?,rm212,6,https://www.reddit.com/r/AskUK/comments/1ecksu5/home_insurance_called_our_builder_to_haggle_on/,"Hi there, 

Just wanted to asked if people have ever heard of this happening. 

Our home insurance provider is currently settling a claim we had with them. They’re £275 off from what the cheapest builder of the three quotes we’ve submitted at asking for. It is a cash settlement, so they’re not engaging the builder directly. 

Today, they called the builder directly to try to haggle him down by the £275. We weren’t told that they were going to do this in advance, only after they had already done it. The builder has asked for the weekend to consider, just worried that they might get annoyed and pull out after being pressured by the insurance company directly. They were already over £1000 cheaper than the other two quotes. 

This direct contact to haggle with them seems very strange, I’ve never heard of it happening before. Has anyone else had an experience like this? 

Thanks in advance! "
Is home insurance worth it?,PathologicalLiar_,4,https://www.reddit.com/r/AskUK/comments/qvmo93/is_home_insurance_worth_it/,"Wife is suddenly terrified of break ins and theft, suggesting spending £1000 on a security system (cameras, sensors and range extensions etc). 

I am not sure if it’s worth it, perhaps home insurance is a more practical alternative? How much does it usually cost per month?"
What are my options for home insurance?,Anxious-G-231,1,https://www.reddit.com/r/AskUK/comments/17bdkq1/what_are_my_options_for_home_insurance/,"Hello! I moved to the UK 6 months ago. I’ve had issues getting a permanent place to rent but was able to get one two months after. My agent had suggested for me to get a home insurance (for my belongings as the landlord already has property insurance) but because of some other things I need to arrange to fully get settled in I haven’t gotten one yet. Four months into renting, I’ve been researching online but can only see 12 month plans, which is okay but me and my partner are planning to move to a bigger place after the contract here ends.

My question now is, are there options to obtain monthly insurance instead or less than 1 year coverage? Or if i get a one year insurance, will I be able to carryover the policy in case we successfully move after our current tenancy? 

Also, any suggestions? I was looking into Aviva and Admiral but would love to hear your thoughts?

Thank you in advance for reading and for any replies! Would be very helpful! ☺️"
Can someone advice on best home insurance?,Ffxiv-TOS,0,https://www.reddit.com/r/AskUK/comments/178za7e/can_someone_advice_on_best_home_insurance/,I’ve heard that some insurance companies aren’t willing to cover on a house if it’s going through probate and is empty. It would be really appreciated if anyone who has had to apply for home insurance can advise on the companies they went with.
"As a tenant, should I buy home insurance?",tpnat45,3,https://www.reddit.com/r/AskUK/comments/152z9je/as_a_tenant_should_i_buy_home_insurance/,"The tenancy contract by itself, doesn't mention of home insurance or anything like that. So, legally I am not obliged to buy it? However, if something goes wrong in the house, say a window is broken or there is some damage to the wall or even a small fire destroyed part of the house, would I be in immense financial debt to cover such things? Do home owners insure their house and does that cover such issues? Please help me understand how it works. "
Rebuild/contents value for home insurance?,bollarddd,4,https://www.reddit.com/r/AskUK/comments/xf2nzg/rebuildcontents_value_for_home_insurance/,"Hi there

My husband and I bought our home 7 years ago and I am renewing our home insurance through a broker (always purchased it direct before but our cover needs have changed). Our previous cover has always been unlimited for both the rebuild cost of the home and contents. The broker says I have to stipulate an amount for both aspects and I have no idea how much it costs to rebuild a home. I asked them if there was a set amount usually suggested for our size of home and location but they don’t seem keen to provide any guidance. Any idea where I can find out what a reasonable amount would be? Thanks!"
Are there any Home insurance companies that actually pay out?,Objective-General-88,3,https://www.reddit.com/r/AskUK/comments/127rgp2/are_there_any_home_insurance_companies_that/,"I’m renewing my home insurance and looking at reviews. I’ve gone through about 10 companies’ trustpilot and reviews. They all have 5 star reviews saying how easy it is to get insurance, then all 1 star reviews from people who have actually needed to claim. 
Are there any home insurance companies in the UK that do pay out without huge amounts of hassle in the event that you have claimed? 
At the moment I’m considering going with the cheapest (Hastings premier or Intelligent Insurance) since they are all brokers and all have the same awful reviews regardless of price."
Can you claim home insurance for large electric bill due to fault?,holybannaskins,3,https://www.reddit.com/r/AskUK/comments/16jnk2o/can_you_claim_home_insurance_for_large_electric/,The immersion heater in my parents house was faulty and stayed permanently on for a prolonged period of time. This has led to a huge electricity bill. I don't suppose insurance would ever cover that...
If you withdraw a claim does your home insurance premium still go up?,Crackgodx,1,https://www.reddit.com/r/AskUK/comments/176fqo1/if_you_withdraw_a_claim_does_your_home_insurance/,"Hi, I am getting some work assessed after a leak and have informed my home insurance provider. I was wondering if it's worth following through with the claim if the work is below a certain amount? (For example with a very minor car accident)

Or now that I've started the process will they increase the premiums regardless I withdraw?"
Home insurance claims experience?,iluvtsumtsum,3,https://www.reddit.com/r/AskUK/comments/nbg4fd/home_insurance_claims_experience/,"We are looking to buy home insurance as our old provider is putting in a 10% increase to the renewal premium, despite not having claimed a single penny every since we bought the policy with them.  Just went on confused.com and bunch of company came up giving a much lower premium providing pretty much the same cover.  With home insurance, unfortunately you won’t know how good the company is until you need to make a claim. Just want to see if there are any ones we need to avoid. Tescobank is coming up cheapest, anyone has any experience with them?

Many thanks in advance."
Home insurance with subsidence?,rread97,2,https://www.reddit.com/r/AskUK/comments/udviem/home_insurance_with_subsidence/,"Can anybody point me in the right direction of a company who my family can use to take out home insurance on our house that’s being renovated and includes subsidence (which is being fixed) as part of the renovations.

Have tried several insurance companies and they all say the same, won’t insure until the subsidence is fixed and they also won’t give us any advice/direction of what to do next?"
Should I go through home insurance for white goods?,jimjamming,3,https://www.reddit.com/r/AskUK/comments/yr14ax/should_i_go_through_home_insurance_for_white_goods/,"Apologies for the ignorance. My dishwasher has broken and I want to buy a new one, but some people have said that I should go through my home insurance to get it sorted. I still need to check the policy, but I was wondering what I should do? 

Our washing machine broke a few months back and I just replaced it myself with a new one. Should I have gone through insurance then? Very confusing  stuff"
Does anybody have any good home insurance recommendations for contents stored both inside home and in shed?,2ManyProblems2,2,https://www.reddit.com/r/AskUK/comments/13yqnon/does_anybody_have_any_good_home_insurance/,"As the title suggests, I am looking into adding home contents cover to my include high value items stored in my shed. 

&#x200B;

I store a couple of bikes in my shed which together are probably worth \~£8,000. Storing them within my home has become unviable, however, my current insurance with admiral does not cover contents stored in outbuildings/sheds unless I pay for the premium package but this would still only cover the shed for a maximum of  £5,000. 

I looked into Lakka bike insurance which would be \~£40 a month, but I feel like paying £480 a year on top of my current home insurance seems a bit much when there is likely a insurer out there that would simply add the shed to my current premium (hopefully covering it for the entire £8000).

&#x200B;

Does anybody know of any home insurers that do this? I have tried [comparethemarket.com](https://comparethemarket.com) but it doesn't give an option for specifying insurers that cover high value items stored in sheds."
Employer suggesting I add my company laptop to my personal home insurance. Is this normal?,Inevitable-Sherbert,7,https://www.reddit.com/r/AskUK/comments/109giun/employer_suggesting_i_add_my_company_laptop_to_my/,"I’m pretty sure that unless you are the owner, and purchased the item your home insurance won’t cover it."
Why does home insurance need to know about building work?,Swimming_Army1908,1,https://www.reddit.com/r/AskUK/comments/whldpd/why_does_home_insurance_need_to_know_about/,"I'm renewing my home insurance and they ask if there is any building work going. I currently do have a porch being replaced however this will be completed by the time they renewal starts. Do I still need to tell them that I have building work going on as it won't be at the time of activation? 

I have tried contacting insurance companies regards this however have been unsuccessful in getting an answer.

Edit - I got an answer, they like to know because of damages/theft. They also said I can wait until building work is done before completing the quote, providing of course the work is actually complete before the insurance is needed."
"Home insurance claim for stolen bike, help?",Guy8910,3,https://www.reddit.com/r/AskUK/comments/pxsetm/home_insurance_claim_for_stolen_bike_help/,"Hi AskUk, I am trying to make a contents insurance claim for a bike that was stolen in London, big surprise I know.

Anyway the insurer is seeking to deny payment over the fact that I am the sole named policyholder and the bike technically is my girlfriends who I live with and that therefore her contents apparently aren't covered as she is an adult over 18 who is not a listed policyholder.

This bike was specifically listed as an item to be insured when I got the policy as well.

Does anybody have any idea how to approach this. The bike cost £1,300 so I think that the claim is worth it over the slight potential increase in premiums next year."
Home insurance for one month?,player_zero_,4,https://www.reddit.com/r/AskUK/comments/jb74ic/home_insurance_for_one_month/,"Hiya, I'm selling my house and it'll probably complete next month, but my home insurance has run out and apparently its standard practice to insure for a full year 🤷‍♂️

Could anyone recommend a decent short term insurance company please or advice on how to tackle the one month please? Thanks very much!!"
Boring Home Insurance Question,grmacp,0,https://www.reddit.com/r/AskUK/comments/9w3xcn/boring_home_insurance_question/,"2 questions really.

1. Why can't my current insurer match my renewal quote to the same price as a new quote? It seems such a faff cancelling and then signing up as a new customer

2. Does anyone know anything about Hastings Essential? There is £10 of difference between them and Hastings Directfor what I can see is an identical quote"
URGENT: How to get mum to buy home insurance,homeinsuranceq,0,https://www.reddit.com/r/AskUK/comments/2zxyg9/urgent_how_to_get_mum_to_buy_home_insurance/,"

I just discovered that my mum doesn't have ANY home insurance whatsoever. My mum owns her own house outright, mortgage paid off years ago, but she doesn't have home insurance. I told her she needs to have home insurance by law, and everything I have read online says I am right. Besides the utter foolishness of gambling with the weather that could destroy the house at any time and she'd lose everything without insurance to cover the cost, what if a brick blows off the roof and hits a pedestrian? She would be liable for millions in compensation. But she insists that it isn't a legal requirement and that nothing bad will come of not having it. How do I convince her that she is wrong and get her to buy insurance? I am seriously freaking out about this. I don't want to report her to the council but if she leaves me no alternative then I have to. I really just need to convince her to get insurance before they find out."
Home insurance in the short term,BristolBomber,2,https://www.reddit.com/r/AskUK/comments/9g9vrc/home_insurance_in_the_short_term/,"We are about to move house (conveyancing currently, so hopefully 8-10 weeks). 
However our home insurance is die for renewal.

I know buildings and contents is not super expensive stuff but i would rather not be paying for a year when we will only need a few months before movibg to our new property.

What options do we have? (this is the first time we have sold and moved so i don't really know the deal here)."
How do you find out information about the house for home insurance prior to moving in?,emilesmithbro,1,https://www.reddit.com/r/AskUK/comments/sclmly/how_do_you_find_out_information_about_the_house/,"We are completing on a house in a few weeks time, and our solicitor suggested getting home insurance from the completion date because at that point it’s our responsibility. My uncle’s family have been a victim to this - a day after completion a previous owner’s disgruntled ex wife came in a damaged floors and walls, thankfully only cosmetic damage but still costs money to repair. 

When getting quotes, there are some questions which I just wouldn’t know an accurate answer to, such as the exact type of locks used on every door, and I’m conscious of the fact that providing wrong info may invalidate insurance. 

Should I speak with the agent to get this information, or ask about current home insurance? Not sure if it’s too much to ask."
Home insurance question,Crnhyuo,1,https://www.reddit.com/r/AskUK/comments/4uckdg/home_insurance_question/,"Does home insurance cover natural deterioration over many years, like needing a new roof because it has come to the end of its life, or do you still have to pay for that in addition to paying for insurance?"
home insurance issue :( being fobbed off,diamondnine,2,https://www.reddit.com/r/AskUK/comments/51vrlq/home_insurance_issue_being_fobbed_off/,"Hi 
I had a leak at my house as the leak was under the floor we didnt notice untill we recived a letter from our water company.

I immediately contacted my insurance Barclays (Aviva), long story short they installed some drying machines which didnt cover all the areas now i can smell dump, when i complained they are saying this is due to rain water which i believe is not true as i have lived in the house for over 4 years and never had this problem before.

They are refusing to help me and i am worried about the well being of my family, what options do i have? If you have been in a similar situation please share your expertise.

Thanks

"
Leak destroyed by kitchen floor. Got a claim in progress with home insurance then found the leak was caused by a faulty Amazon purchase. Do I continue the claim or pursue damages with Amazon? Or both?,greenhedgeman,2,https://www.reddit.com/r/AskUK/comments/12bocdp/leak_destroyed_by_kitchen_floor_got_a_claim_in/,Leak destroyed by kitchen floor. Got a claim in progress with home insurance then found the leak was caused by a faulty Amazon purchase. Do I continue the claim or pursue damages with Amazon? Or both?
Have you ever gone full Karen and asked to speak to the manager? What was the result?,MerlinOfRed,681,https://www.reddit.com/r/AskUK/comments/10o50ld/have_you_ever_gone_full_karen_and_asked_to_speak/,"I'm inspired by the replies on another thread about people turning into so-called 'Karens', but which I mean asking to speak to the manager. I used the ""can I speak with your manager"" line for the first time last week and it was mortifying. I was so ashamed of myself, but it worked and I got the result that I wanted.

I had been contacted by a debt collection agency informing me that I needed to pay them £75 due to unpaid cancellation fee on my home insurance. The problem was, I'd never cancelled my insurance and this was the first time I'd heard that my flat was uninsured. 

I renewed my insurance in November. I had received all the information documents on my online account. I checked them at the time and then got on with my life. Apparently it had been cancelled in December and I had no idea. I phoned the insurance, explained the situation, and I was back and forth with this lady for over an hour.

What had happened was that the payment hadn't gone through so they sent me a letter in the post informing me. They continued to send letters as they escalated the situation, cancelled my policy, slapped on a £40 fine, and then increased this to £75 when I still didn't pay. The issue was that although they had changed the flat that was insured, they hadn't actually updated my postal address. All these letters were going to my old flat. I was none the wiser.

The lady I was speaking to was insisting that I paid and saying that there was nothing she could do. After an hour of this, I asked if there was anyone else I could speak with. She first said ""I think my manager is busy, are you sure?"". I insisted. The manager solved the whole situation in under 3 minutes. The entire fee was waived, I was reinsured, and I even got two months insurance for free as a 'goodwill gesture'.

I feel guilty for asking to speak to the manager as it probably reflects badly on the likely overworked call centre employee, but I think she probably didn't have the permissions to do what needed to be done. By going to the manager I was able to save everyone valuable time - I only wish I'd done so sooner.

Does anyone else had a similar story? Or have you ever been on the other end and thought that the customer might have a point?"
Anyone made use of Legal Protection that is a part of some Home Insurance policies?,2monkeys1coconut,4,https://www.reddit.com/r/AskUK/comments/6b6ifg/anyone_made_use_of_legal_protection_that_is_a/,"Some of the Home Insurance policies include legal protection. Typical wording of one such policy is attached at the end of this post. Has anyone successfully used such a policy for settling legal claims?

I am considering getting such a policy for a leasehold I am looking to buy. Per the rep selling the policy this policy would cover disputes with freeholder or the property management company. Just checking if anyone has experience using policies like this to cover legal expenses including disputes with freeholder or property management companies. 

Typical language


What it covers

* Family Legal Protection provides up to £100,000 legal costs to help with a legal claim

* Legal advice line available 24 hours a day, 365 days a year

* No excess to pay

What it doesn’t cover

* Cover when there is less than a 51% chance of a successful claim
"
"What personal insurances do you have, and which do you think are worth it?",FuckingPope,7,https://www.reddit.com/r/AskUK/comments/1764z1c/what_personal_insurances_do_you_have_and_which_do/,"For example, do you have any life insurance or income protection insurance or anything like that? 

I've got to get a home insurance for a place, but the person doing it is talking about all these other ones, so wanted to see which are worth it."
"Is my property classed as ""unoccupied""?",nrugor,13,https://www.reddit.com/r/AskUK/comments/195wfxd/is_my_property_classed_as_unoccupied/,"Moved into a new home, my old home is now empty. Home insurance is due in a few weeks. One question was, ""Will the property be unoccupied for more than 30 days?"".

I visit the property every week or two to collect the mail and have a look around (it's a few hundred meters away).

Would these visits count as occupying the property?"
Can I get buildings insurance for 6 months?,Connect_Boss6316,3,https://www.reddit.com/r/AskUK/comments/18dswl1/can_i_get_buildings_insurance_for_6_months/,"My buildings and contents insurance is up for renewal in a week. I know that in 6 months I'll sell my house. I couldn't find any decent home insurance for 6 months (there are insurance quotes for unoccupied or undergoing-refurb properties but they're even more expensive than my annual quote).

So, my question is - if I get an annual policy and sell my house in 6 months, will the insurance company give me a refund of sorts?

Tia."
"If the wind carries off one of my fence panels, am I supposed to go out searching for it?",Jenkes_of_Wolverton,1,https://www.reddit.com/r/AskUK/comments/19c3vd3/if_the_wind_carries_off_one_of_my_fence_panels_am/,"I have home insurance, and wouldn't want to go out till after the weather is calmer. Just wondering how these things would pan out and if I am personally responsible for retrieval."
Do I need to claim back all of the VAT of my insurance settlement in one claim?,dandrage76,1,https://www.reddit.com/r/AskUK/comments/1d9truj/do_i_need_to_claim_back_all_of_the_vat_of_my/,"Reclaiming VAT from house insurance settlement

I'm in England.

 (I posted this in legal advice but didn't get any responses so I'm trying here instead).

I'll try to keep this short and to the point, but if more details are needed I am happy to provide. 

We claimed on our home insurance due to an escape of water and were told by the insurance company that they omit the VAT amount and we can reclaim it once the work has been done and we have provided invoices. 

The settlement figure was (round figures only) £24k with £4k removed for VAT and £500 reduced for the policy excess meaning we received £19.5k

I have sent them an invoice for £6k for the supply of a kitchen and have been told that I must reclaim all of the VAT in one go by providing invoices of at least the settlement figure (£19.5k).  Is this correct, legally speaking?  I understand they would prefer to just make one payment, but surely I should be able to claim back part of the VAT amount that was omitted."
Is it childish to post a rant on local Facebook group after a tom cat ruined a room in my house?,12point75,0,https://www.reddit.com/r/AskUK/comments/11dhmhx/is_it_childish_to_post_a_rant_on_local_facebook/,"An un-neutered cat somehow got locked into the house over the weekend and managed to hide itself in a room we hardly use. The outcome was a very smelly room and we have had to completely gut the room, flooring and certain non washable items as the stench was unbearable. The cat seemed well looked after and didn't seem feral so I think someone owns it.

So far we have washed and repainted the walls and skirting and ripped up, and in the process of,  replacing the laminate flooring. Our home insurance company says we are not covered. Yay!

Should I post a rant on the local Facebook group or just suck it up? I've asked around neighbours and they don't know who's cat it may belong to."
"Neighbour's tree likely to fall, what to do?",Several-Pickle-5108,38,https://www.reddit.com/r/AskUK/comments/1bo4z0d/neighbours_tree_likely_to_fall_what_to_do/,"My neighbour (lone female) has a tree that is overrun with ivy, and is well on its' way to falling over due to being so to top heavy, you can see the roots are being pulled out of the ground.  The tree is in her garden, being held up by her fence, but leans into my garden and its current lean angle means it will fall on top of my boundary fence.  The lean of the tree is now so steep that I won't let my young lad play under the tree, as the her fence could give way without warning.  I have had reasonable quotes from professional tradesmen who deal with dangerous tree removal and passed them onto her, as she was getting stupid quotes by tradesman when they visited her - clearly looking to fleece her for the work.

QUESTION: Should I be encouraging her (and how to do this without looking like I am bullying her) to come to a decision really quickly (before the tree and ivy gets thicker/heavier), or should I reach out to my home insurance and let them deal with it?  

FACTS: She doesn't own her home any more (sold it to a pension/equity release company) but I suspect she is liable for the up-keep, her picket fence is propping up the tree and it will fall on my fence line causing damage to concrete posts, kickboard and 5ft wooden panels."
