Title,Author,Score,URL,Text
Bad experience with an insurance company and don't know where I stand?,tolpedicat,3,https://www.reddit.com/r/AskUK/comments/6vzjxi/bad_experience_with_an_insurance_company_and_dont/,"sorry if this doesn't belong here - just let me know and I will remove :)
This is long. I am going to bullet point most of it so it's easier to digest. A little background though - me and my partner bought a house a few months ago, and 3 insurance policies (as far as i can gather) were set up by our financial adviser with no input from us. The UK company is a very well known one, which I thought were well thought of (a google search shows them having a 3.1 on TrustPilot though). The insurance I think we have is critical illness cover for the two of us, and home insurance. Here are the issues we've had.

1) We have had no confirmation from the company that we have any policies with them. so i'm only assuming what we have - I have nothing solid on paper or digitally. yes, they're charging us monthly for these.

2) Because we have no confirmation, we have no policy number or any terms/conditions. This is the only reason why we haven't stopped paying in case they charge us some extortionate fee that we cannot afford, because we don't know the terms of cancellation.

3) The very few letters they've sent has gone to our old addresses, even though they have our new one. They sent out a form for us to complete in June, (which we only got from the people living there in August) and on the letter it states that if it's not sent back to them within 14 days they cannot start the policy (this is how I know we have Critical Illness Cover - they were health forms for it). They haven't received a response, but they're still charging for it. Have they contacted us asking why we haven't responded? nope.

4) We have no terms and conditions. For anything. For example I'm pretty sure we have home insurance with them, but if something was to happen we have no idea who to call, what to quote and what the hell is covered and what's not.

5) I've emailed. with all of the above. they told us to 'login to our account online' to see what we have. um, we can't? you've never sent us any login details or anything? so we set that up - but now we're locked out because their friggin password didn't work. To sort it we have to call a number that charges. Great. Thanks guys

6) When I emailed them, they didn't respond to me, but emailed my partner. Pretty rude but whatever. Shows they have his contact details though. OH - and the email had terrible grammar, the wrong dates and seemed to be written by a 9 year old ... to the point where we thought it was a scam at first.

Please help. Any advice about anything will help. I'm just sick of being in the dark and I feel like i'm stuck paying these guys. :("
What happens if the communal stairway where you own a flat gets condemned?,Sanuuu,2,https://www.reddit.com/r/AskUK/comments/i2xlcq/what_happens_if_the_communal_stairway_where_you/,"I'm looking to buy a flat at some point in the next year or so. The area I'm looking at is dominated by victorian tenements which are in a... variable condition. Most of them have been around for some 120 years. This got me thinking - surely there must be an expiry date on a building.

That in turn made me wonder what happens if a building enters it's end-of-life through no fault of your own, like an inspection discovering a fundamental fault with the walls or the other owners of flats in the stairway refusing to pay up should a major maintenance fault crop up.

What happens in such a situation. Do home insurances cover that usually? Or do you just write off the property?"
Travel insurance valuables cover question,strauje,1,https://www.reddit.com/r/AskUK/comments/2djoji/travel_insurance_valuables_cover_question/,"Heading to the States for a couple of weeks on Tuesday and still need to buy travel insurance. All the policies on Money Supermarket and whatever look fine apart from the maximum single-item value limit. 

Most of the policies have a cap of £3-500 per item under contents cover, but I want to take my laptop and camera with me which are both worth more than that. 

So just wondering if anyone has any advice as to how to get these covered in the most cost-effective way possible because I'm not particularly well-versed when it comes to the wide world of insurance. Can't be put on our home insurance unfortunately before anybody suggests that. 

Thanks a bunch for any help. "
Getting an idea about quality of life and cost of living in Cheshire (potential job opportunity near Warrington)?,fertthrowaway,6,https://www.reddit.com/r/AskUK/comments/r7n840/getting_an_idea_about_quality_of_life_and_cost_of/,"Hi, I'm American and my husband is Hungarian and we have a 3 year old daughter. We're currently living in the Bay Area of CA. We moved here in early 2018 after spending several years in the Copenhagen metro area, since I got a job offer with relocation and I wanted to try out the crazy biotech scene here. I have a PhD and work in biotech (very specific niche role for which there are more jobs in the Bay Area than anywhere else) and my husband also has a PhD and is currently a senior engineer at a global company with a UK office in Gloucestershire. He might be able to arrange remote work with them and a lot of their UK staff are remote (he is currently over 95% work from home now).

While there are things we like here, it's crazy expensive and competitive and I felt like I missed Denmark since the moment we got here. I've mostly readjusted to the US but things that used to be normal to me drive me nuts now. Salaries are really high but it still feels like the cost of living eats it up. Quality of life is particularly poor where we're located in this region due to high crime and homelessness, and housing is too expensive to do anything but indefinitely rent and we're in our 40s and tired of this.

So I was recently contacted on LinkedIn by a UK headhunter for a highly appropriate role (right level and exactly what I do) and found out in a call today that the job is between Liverpool and Manchester (looked up exact location and it seems to be in a research park south of Warrington, technically in Daresbury) and he thinks I'd be in the £55-60k salary range. If my husband could arrange something with his company, he would most likely also be in that range. Of course still a lot to get through with interviewing, and maybe they'll just prefer a UK candidate in the end etc, but I'm trying to figure out what things look like cost of living wise there with £110-120k combined salaries? What would after tax monthly income look like, after pension and tax and all that? How much does childcare typically cost in this region and is it hard to find spots in daycares? How are public schools? 

We would want to buy a house if we went there, maybe after initially renting to get our bearings. I'm seeing 3 br free-standing homes listed for minimum £250-400k in the area (what does it mean when a listing says e.g. ""offers in excess of £235k"" - and do homes go well over list price usually or close to it? Bay Area is absurd and stuff goes for $300+k over list in bidding wars so I have no idea anymore). I could put a large deposit of maybe up to £120k and real estate website says on that for a £300k price it'd only be £634/mo on a 35 year mortgage (friend there told us if you get a 35 year loan you can pay it back early, which we would definitely do at that price) which seems really low. What other costs are there, are there property taxes, home insurance etc and what would those add? 

Thanks for any ballpark ideas and numbers, or any other comments about this region...would save me a lot of time vs extensive research when I don't even have an employment offer yet. I was happy the position was not in the southeast although I know the northwest is more rough but ""up and coming"", or at least that's been my impression."
Garage door has broken just before house move.,MaltDizney,7,https://www.reddit.com/r/AskUK/comments/9obaie/garage_door_has_broken_just_before_house_move/,"Me and the Mrs are moving out of her owned flat in a couple days, and due to Murphy's law the garage door has decided to break (I believe a cable has snapped or something) preventing it from closing.


We have NO time to deal with this before the move takes place, how do we go about sorting this out? Is it something that we're obligated to do?


Some additional notes, the home insurance has ended and the new owners policy has commenced as of the contract exchange date last week. But I didn't want to assume that they should just make a claim under their policy. If its a case of they move in, and we're liable to pay then so be it, and less stress as we'd have moved by then.


Edit: Thanks for all the responses. We ended up telling our solicitor, and she arranged for a modest retention fee to be left to the buyer for cost of fixing. Made life much easier not having to deal with it directly."
A landlord is avoiding paying council tax - am I liable for tax evasion?,tax_pedant,2,https://www.reddit.com/r/AskUK/comments/2a9e88/a_landlord_is_avoiding_paying_council_tax_am_i/,"So I'm currently looking around for a place to rent. Found the perfect house that ticks all the boxes - on viewing the property and meeting the landlord, they tell me that I won't have to pay council tax or for Sky TV.

How the landlord explained the situation: the house was previously a holiday home (as are four other homes on the landlord's site). The landlord deliberately hasn't  registered the house with the council as a permanent residence since it stopping being a holiday home, so there is no council tax. 

Now obviously, this is dodgy and absolutely evading paying council tax and makes me very uncomfortable. I'm pretty sure that all the other properties on the site are in the same position. My question is - how much of this is my problem? I know it is the tenant's responsibility to pay council tax, but is it the tenant's responsibility to get the property correctly assessed by the council? Would I be liable through knowing about it and not reporting it?

It rang a lot of alarm bells: would having the home not properly assessed void my home insurance in the case of an accident? Could I not join the electoral register in the area as the council would then know I'm living in a non-listed house? 

Many thanks for any help you knowledgeable people can give!

"
